{
  "$schema": "http://json-schema.org/draft-07/schema#",
  "$id": "shared/schemas/core/inputs.schema.json",
  "title": "Skill inputs.json metaschema",
  "description": "Validates per-skill inputs.json files. Three top-level conventions are accepted: items[] (the canonical WI1 interview taxonomy, used by db-layout / earthing / fault-level / lighting-layout / sld — each item validated against InputItem), inputs[] (legacy form used by arc-flash + arc-flash-labelling), input_groups[] (grouped form used by cable-sizing + small-power). Only items[] currently carries strict per-item validation.",
  "type": "object",
  "required": ["skill"],
  "additionalProperties": false,
  "properties": {
    "$schema": { "type": "string" },
    "skill":   { "type": "string", "description": "Skill id matching the parent skill.manifest.json" },
    "version": { "type": "string", "description": "Semver of this inputs taxonomy" },
    "description": { "type": "string" },
    "items": {
      "type": "array",
      "minItems": 0,
      "items": { "$ref": "#/definitions/InputItem" },
      "description": "Canonical WI1 interview items. Used by db-layout, earthing, fault-level, lighting-layout, sld."
    },
    "inputs": {
      "type": "array",
      "minItems": 0,
      "description": "Legacy alias used by arc-flash + arc-flash-labelling. Item shape is not currently strict-validated."
    },
    "input_groups": {
      "type": "array",
      "minItems": 0,
      "description": "Grouped form used by cable-sizing + small-power. Item shape is not currently strict-validated."
    }
  },
  "oneOf": [
    { "required": ["items"] },
    { "required": ["inputs"] },
    { "required": ["input_groups"] }
  ],
  "definitions": {
    "InputItem": {
      "type": "object",
      "required": ["id", "label", "answer_type", "required"],
      "additionalProperties": false,
      "properties": {
        "id": {
          "type": "string",
          "pattern": "^[a-z][a-z0-9_]*$",
          "description": "snake_case identifier; stable contract surface"
        },
        "label": {
          "type": "string",
          "description": "Human-readable question text shown to the engineer"
        },
        "hint": {
          "type": "string",
          "description": "Optional clarifying text shown under the question"
        },
        "answer_type": {
          "enum": ["enum", "int", "float", "boolean", "text", "enum_list", "struct_list"],
          "description": "Determines UI control and validator behaviour"
        },
        "options": {
          "type": "array",
          "items": { "type": "string" },
          "description": "Required when answer_type is enum or enum_list"
        },
        "default": {
          "description": "Optional default value; shape must match answer_type"
        },
        "required": {
          "type": "boolean",
          "description": "true = engineer must answer before skill runs"
        },
        "validator": {
          "type": "string",
          "description": "Reference to a named validator in shared/validation/validators.json"
        },
        "depends_on": {
          "type": "array",
          "items": { "type": "string" },
          "description": "IDs of items whose answers must be present before this question is shown"
        },
        "project_fact_candidate": {
          "type": "boolean",
          "description": "Forward-compat: items describing the building (not THIS room/design) that a future project-memory feature can pre-fill"
        },
        "item_schema": {
          "type": "object",
          "description": "Required when answer_type=struct_list; JSON Schema for each list element. Depth 1 only — no nested struct_list."
        },
        "grounded_source": {
          "description": "Closed-grammar binding to a SkillInput field. Orchestrator auto-fills this item from the parsed model. Two-tier validation: closed enum for canonical room.* + project.* bindings; pattern fallback for project.<custom> bindings (manifest-lint flags those for orchestrator-confirmation). Uses anyOf so canonical project.* values satisfy both tiers without conflict.",
          "anyOf": [
            {
              "type": "string",
              "enum": [
                "room.type",
                "room.area_m2",
                "room.bbox.length",
                "room.bbox.width",
                "room.centroid.x",
                "room.centroid.y",
                "room.mounting_height",
                "room.polygon",
                "project.building_type",
                "project.code_basis",
                "project.jurisdiction",
                "project.units",
                "project.ceiling_height_mm",
                "project.project_id"
              ]
            },
            {
              "type": "string",
              "pattern": "^project\\.[a-z_]+$"
            }
          ]
        }
      },
      "allOf": [
        {
          "if": {
            "properties": { "answer_type": { "enum": ["enum", "enum_list"] } }
          },
          "then": { "required": ["options"] }
        },
        {
          "if": {
            "properties": { "answer_type": { "const": "struct_list" } }
          },
          "then": { "required": ["item_schema"] }
        }
      ]
    }
  }
}
